123,id97,"How many parameters will be required to be estimated in total for all equations of a standard form, unrestricted, tri-variate VAR(4), ignoring the intercepts?",12SALILSPLITCHECK4SALILSPLITCHECK3SALILSPLITCHECK36 (correct), A,0.0,C,0.0, B,0.0,D,1.0,A,0.0, D,1.0,D,1.0, B,0.0, D,1.0, D,1.0, C,0.0,D,1.0, D,1.0,D,1.0, B,0.0,A,0.0,D,1.0,D,1.0, A,0.0,D,1.0,A,0.0,A,0.0, D,1.0, D,1.0, B,0.0,A,0.0,D,1.0, C,0.0, C,0.0, A,0.0,0.507416263404925,Low
79,id57,"Which of the following are plausible approaches to dealing with a model that exhibits heteroscedasticity?

i) Take logarithms of each of the variables

ii) Use suitably modified standard errors

iii) Use a generalised least squares procedure

iv) Add lagged values of the variables to the regression equation.","(ii) and (iv) onlySALILSPLITCHECK(i) and (iii) onlySALILSPLITCHECK(i), (ii), and (iii) only (correct)SALILSPLITCHECK(i), (ii), (iii), and (iv)", D,0.0,D,0.0, D,0.0,B,0.0,B,0.0, C,1.0,C,1.0, D,0.0, C,1.0, C,1.0, C,1.0,D,0.0, D,0.0,C,1.0, A,0.0,C,1.0,D,0.0,B,0.0, D,0.0,C,1.0,C,1.0,D,0.0, D,0.0, C,1.0, D,0.0,C,1.0,C,1.0, A,0.0, C,1.0, C,1.0,0.507416263404925,Low
77,id55,"The purpose of ""augmenting"" the Dickey-Fuller test regression is to",Ensure that there is no heteroscedasticity in the test regression residuals.SALILSPLITCHECKEnsure that the test regression residuals are normally distributedSALILSPLITCHECKEnsure that there is no autocorrelation in the test regression residuals (correct)SALILSPLITCHECKEnsure that all of the non-stationarity is taken into account., C,1.0,D,0.0, D,0.0,C,1.0,D,0.0, D,0.0,D,0.0, D,0.0, C,1.0, C,1.0, D,0.0,C,1.0, D,0.0,D,0.0, C,1.0,C,1.0,D,0.0,C,1.0, C,1.0,C,1.0,C,1.0,D,0.0, C,1.0, D,0.0, D,0.0,C,1.0,C,1.0, D,0.0, C,1.0, C,1.0,0.507416263404925,Low
88,id65,"Which of the following are alternative names for the dependent variable (usually denoted by y) in linear regression analysis?

(i) The regressand

(ii) The regressor

(iii) The explained variable

(iv) The explanatory variable","(ii) and (iv) onlySALILSPLITCHECK(i) and (iii) only (correct)SALILSPLITCHECK(i), (ii), and (iii) onlySALILSPLITCHECK(i), (ii), (iii), and (iv)", B,1.0,D,0.0, D,0.0,B,1.0,B,1.0, C,0.0,B,1.0, D,0.0, B,1.0, B,1.0, C,0.0,D,0.0, B,1.0,D,0.0, D,0.0,B,1.0,B,1.0,B,1.0, B,1.0,B,1.0,C,0.0,C,0.0, D,0.0, B,1.0, D,0.0,B,1.0,B,1.0, D,0.0, D,0.0, B,1.0,0.507416263404925,Low
47,id26,"Consider the estimation of a GARCH-M model. If the data employed were a time-series of daily corporate bond percentage returns, which of the following would you expect the value of the GARCH-in-mean parameter estimate to be?",Less than -1SALILSPLITCHECKBetween -1 and 0SALILSPLITCHECKBetween 0 and 1 (correct)SALILSPLITCHECKBigger than 1, C,1.0,C,1.0, B,0.0,B,0.0,C,1.0, B,0.0,B,0.0, B,0.0, C,1.0, C,1.0, B,0.0,B,0.0, B,0.0,B,0.0, C,1.0,C,1.0,C,1.0,B,0.0, C,1.0,B,0.0,C,1.0,B,0.0, B,0.0, B,0.0, C,1.0,C,1.0,B,0.0, C,1.0, B,0.0, C,1.0,0.507416263404925,Low
105,id80,Which of the following is a disadvantage of the fixed effects approach to estimating a panel model?,"The model is likely to be technical to estimateSALILSPLITCHECKThe approach may not be valid if the composite error term is correlated with one or more of the explanatory variablesSALILSPLITCHECKThe number of parameters to estimate may be large, resulting in a loss of degrees of freedom (correct)SALILSPLITCHECKThe fixed effects approach can only capture cross-sectional heterogeneity and not temporal variation in the dependent variable.", A,0.0,D,0.0, B,0.0,C,1.0,C,1.0, B,0.0,C,1.0, B,0.0, C,1.0, C,1.0, A,0.0,B,0.0, D,0.0,B,0.0, C,1.0,C,1.0,C,1.0,C,1.0, D,0.0,C,1.0,C,1.0,D,0.0, C,1.0, B,0.0, D,0.0,C,1.0,C,1.0, C,1.0, B,0.0, C,1.0,0.507416263404925,Low
23,id120,"Which of the following are characteristics of a stationary process?

i) It crosses its mean value frequently


ii) It has constant mean and variance


iii) It contains no trend component


iv) It will be stationary in first difference form","(ii) and (iv) onlySALILSPLITCHECK(i) and (iii) onlySALILSPLITCHECK(i), (ii), and (iii) onlySALILSPLITCHECK(i), (ii), (iii), and (iv) (correct)", B,0.0,D,1.0, D,1.0,C,0.0,C,0.0, D,1.0,B,0.0, D,1.0, C,0.0, C,0.0, C,0.0,D,1.0, D,1.0,D,1.0, D,1.0,B,0.0,C,0.0,C,0.0, A,0.0,C,0.0,D,1.0,D,1.0, D,1.0, A,0.0, D,1.0,A,0.0,C,0.0, D,1.0, D,1.0, C,0.0,0.507416263404925,Low
91,id68,"Consider the following model for $y_t$:

$y_t = \mu + \lambda t + u_t$

Which one of the following most accurately describes the process for $y_t$?",A unit root processSALILSPLITCHECKA stationary processSALILSPLITCHECKA deterministic trend process (correct)SALILSPLITCHECKA random walk with drift, B,0.0,B,0.0, A,0.0,C,1.0,C,1.0, A,0.0,C,1.0, B,0.0, C,1.0, C,1.0, B,0.0,B,0.0, C,1.0,D,0.0, A,0.0,C,1.0,C,1.0,C,1.0, D,0.0,C,1.0,D,0.0,A,0.0, D,0.0, D,0.0, C,1.0,C,1.0,C,1.0, B,0.0, D,0.0, C,1.0,0.507416263404925,Low
96,id72,"Which of the following are alternative names for the independent variable (usually denoted by x) in linear regression analysis?

(i) The regressor

(ii) The regressand

(iii) The causal variable

(iv) The effect variable","(ii) and (iv) onlySALILSPLITCHECK(i) and (iii) only (correct)SALILSPLITCHECK(i), (ii), and (iii) onlySALILSPLITCHECK(i), (ii), (iii), and (iv)", B,1.0,D,0.0, D,0.0,B,1.0,B,1.0, C,0.0,B,1.0, D,0.0, B,1.0, B,1.0, D,0.0,D,0.0, B,1.0,D,0.0, C,0.0,A,0.0,B,1.0,B,1.0, D,0.0,B,1.0,C,0.0,C,0.0, B,1.0, B,1.0, D,0.0,C,0.0,B,1.0, D,0.0, C,0.0, B,1.0,0.507416263404925,Low
100,id76,"Under the null hypothesis of a Bera-Jarque test, the distribution has",Zero skewness and zero kurtosisSALILSPLITCHECKZero skewness and a kurtosis of three (correct)SALILSPLITCHECKSkewness of one and zero kurtosisSALILSPLITCHECKSkewness of one and kurtosis of three., D,0.0,D,0.0, B,1.0,B,1.0,B,1.0, C,0.0,B,1.0, A,0.0, B,1.0, B,1.0, A,0.0,B,1.0, B,1.0,A,0.0, C,0.0,B,1.0,B,1.0,B,1.0, A,0.0,B,1.0,A,0.0,C,0.0, B,1.0, B,1.0, A,0.0,A,0.0,B,1.0, C,0.0, C,0.0, B,1.0,0.507416263404925,Low
107,id82,The price of a house is best described as what type of number?,DiscreteSALILSPLITCHECKCardinal (correct)SALILSPLITCHECKOrdinalSALILSPLITCHECKNominal, A,0.0,D,0.0, B,1.0,B,1.0,D,0.0, D,0.0,D,0.0, D,0.0, B,1.0, B,1.0, B,1.0,D,0.0, D,0.0,D,0.0, B,1.0,A,0.0,D,0.0,B,1.0, D,0.0,B,1.0,D,0.0,C,0.0, B,1.0, B,1.0, B,1.0,B,1.0,B,1.0, B,1.0, D,0.0, B,1.0,0.5085476277156078,Low
103,id79,"Which of the following assumptions are required to show the consistency, unbiasedness and efficiency of the OLS estimator?

i) $E(u_t) = 0$


ii) $\text{Var}(u_t) = \sigma^2$


iii) $\text{Cov}(u_t, u_{t-j}) = 0 \forall j$


iv) $u_t \sim N(0, \sigma^2)$","(ii) and (iv) onlySALILSPLITCHECK(i) and (iii) onlySALILSPLITCHECK(i), (ii), and (iii) only (correct)SALILSPLITCHECK(i), (ii), (iii), and (iv)", B,0.0,C,1.0, D,0.0,B,0.0,C,1.0, C,1.0,C,1.0, D,0.0, C,1.0, C,1.0, B,0.0,C,1.0, D,0.0,D,0.0, A,0.0,D,0.0,C,1.0,B,0.0, D,0.0,C,1.0,C,1.0,D,0.0, D,0.0, C,1.0, D,0.0,C,1.0,C,1.0, C,1.0, D,0.0, C,1.0,0.5085476277156078,Low
111,id86,"Suppose that the value of $R^2$ for an estimated regression model is exactly zero. Which of the following are true?

i) All coefficient estimates on the slopes will be zero

ii) The fitted line will be horizontal with respect to all of the explanatory variables

iii) The regression line has not explained any of the variability of y about its mean value

iv) The intercept coefficient estimate must be zero.","(ii) and (iv) onlySALILSPLITCHECK(i) and (iii) onlySALILSPLITCHECK(i), (ii), and (iii) only (correct)SALILSPLITCHECK(i), (ii), (iii), and (iv)", C,1.0,C,1.0, D,0.0,B,0.0,B,0.0, C,1.0,C,1.0, D,0.0, C,1.0, C,1.0, C,1.0,C,1.0, C,1.0,D,0.0, C,1.0,B,0.0,C,1.0,B,0.0, D,0.0,B,0.0,C,1.0,D,0.0, D,0.0, C,1.0, D,0.0,C,1.0,B,0.0, C,1.0, D,0.0, B,0.0,0.5085476277156078,Low
